Cel_biznesowy,KORZYSCIE_DLA_BANKU_OBSZARU_ZESPOLU,KPI,Korzyść_dla_Banku_Obszaru_Zespołu,NAZWA_PROJEKT,NUMER,OPIS_CO_BADAMY,Opis,PRIORYTET,PROBLEM,Projekt,STATUS,STRUMIEN,TAI_refined_zadania,TAI_tagi,TAI_tagi_list,TAI_tagi_normalized,TAI_tok_myslenia,TAI_uwagi,TYP,WHISPER_NEXIDIA,Zespol_zglaszajacy_potrzebe,dodatkowe,pipeline_key,pipeline_tags,pipeline::frazy-binary,"pipeline::frazy-binary, frazy-clustering, frazy-ekstrakcja","pipeline::frazy-binary, frazy-clustering, frazy-ekstrakcja, frazy-klient-sentyment","pipeline::frazy-binary, frazy-clustering, frazy-klient-sentyment","pipeline::frazy-binary, frazy-ekstrakcja","pipeline::frazy-binary, frazy-klient-ekstrakcja",pipeline::frazy-binaryx2,"pipeline::frazy-binaryx2, frazy-clustering, frazy-ekstrakcja","pipeline::frazy-clustering, frazy-ekstrakcja",pipeline::frazy-ekstrakcja,pipeline::frazy-emocje,pipeline::frazy-klient-ekstrakcja
,% wzrost sprzedaży ŻIŻ do KG jako ubezpieczenie niepowiązane,"SR (Sales Revenue), SV (Sales Volumen)",,Życie i zdrowie,1,Uruchomione KG (1MSC WSTECZ) czy była propozycja ŻIŻ,,1,Zbyt mała sprzedaż ŻIŻ do KG,,,ODZ,"Czy podczas rozmowy telefonicznej (rozmowy sprzedażowej), która zakończyła się podpisaniem umowy kredytu gotówkowego była od doradcy propozycja zakupu ubezpieczenia życie i zdrowie","ofertowanie, frazy-binary, kredyt-got, ubezpieczenia","['ofertowanie', 'frazy-binary', 'kredyt-got', 'ubezpieczenia']","ofertowanie, frazy-binary, kredyt-got, ubezpieczenia",,,BIZNES,,,,frazy-binary,frazy-binary,1,0,0,0,0,0,0,0,0,0,0,0
,% wzrost sprzedaży LC do KG jako ubezpieczenie niepowiązane,"SR (Sales Revenue), SV (Sales Volumen)",,Locum,2,Uruchomione KG (1MSC WSTECZ) czy była propozycja LC,,1,Zbyt mała sprzedaż LC do KG,,,ODZ,"Czy podczas rozmowy telefonicznej (rozmowy sprzedażowej), która zakończyła się podpisaniem umowy kredytu gotówkowego była od doradcy propozycja zakupu ubezpieczenia locum comfort","ofertowanie, frazy-binary, kredyt-got, ubezpieczenia","['ofertowanie', 'frazy-binary', 'kredyt-got', 'ubezpieczenia']","ofertowanie, frazy-binary, kredyt-got, ubezpieczenia",,,BIZNES,,,,frazy-binary,frazy-binary,1,0,0,0,0,0,0,0,0,0,0,0
,% wzrost sprzedaży LC w ZZSKH,"SR (Sales Revenue), SV (Sales Volumen)",,Locum,3,Uruchomione KH (3MSC WSTECZ) czy była propozycja LC,,3,Zbyt mała sprzedaż LC w  ZZSKH,,,ODZ,Czy podczas rozmowy sprzedażowej z klientem zawierającym kredyt hipoteczny doradca proponował ubezpieczenie Locum Comfort?,"ofertowanie, frazy-binary, kredyt-hip, ubezpieczenia","['ofertowanie', 'frazy-binary', 'kredyt-hip', 'ubezpieczenia']","ofertowanie, frazy-binary, kredyt-hip, ubezpieczenia",,,BIZNES,,,,frazy-binary,frazy-binary,1,0,0,0,0,0,0,0,0,0,0,0
,% wzrost konwersji z utrzymania produktu,"SR (Sales Revenue), SV (Sales Volumen)",,Nazwa Query :Rezygnacja_z_produktu_ - konto osobiste,4,Linia Select IN.,,2,Rezygnacja z produktu/zamiana na konto Select,,,SELECT,,"rezygnacja, frazy-binary, konto-osobiste, select","['rezygnacja', 'frazy-binary', 'konto-osobiste', 'select']","rezygnacja, frazy-binary, konto-osobiste, select",,potrzeba doprecyzowania: w jakim kontekście klient rezygnuje z produktu i co oznacza zmiana na konto Select?,BIZNES,,,,frazy-binary,frazy-binary,1,0,0,0,0,0,0,0,0,0,0,0
,% spadek  poczty głosowej w rozmowach wychodzących,NPS,,Nazwa Query: Poczta Glosowa,5,Weryfikacja rozmów wychodzących trafiających na pocztę głosową. Docelowo wyszukanie przetrzymywania poczty głosowej przez doradców.,,3,Zbyt wysoki % poczty głosowej na rozmowach wychodzących,,,ODZ,"Czy doradca utrzymuje połączenie z pocztą głosową, a nie rozłącza się po nagraniu wiadomości/usłyszeniu, że jest to poczta głosowa","service, poczta-głosowa, frazy-binary, call-duration","['service', 'poczta-glosowa', 'frazy-binary', 'call-duration']","service, poczta-glosowa, frazy-binary, call-duration",,wieloetapowe:2 - do doprecyzowania zadanie związane z mierzeniem poczty głosowej,KONTROLA,,,,frazy-binary,frazy-binary,1,0,0,0,0,0,0,0,0,0,0,0
,wzrost ofertowania/sprzedaży KK,"SR (Sales Revenue), SV (Sales Volumen)",,Ofertowanie kart przy rozmowach kredytowych,6,Jak często pada oferta Karty kredytwoej w rozmowach kredytowych,,1,brak dodatkowej propozycji,,,ODZ,"Czy podczas rozmowy telefonicznej o produkcie kredytowym, doradca proponuje ofertę karty kredytowej","ofertowanie, frazy-binary, karta-kredytowa, kredyt-got","['ofertowanie', 'frazy-binary', 'karta-kredytowa', 'kredyt-got']","ofertowanie, frazy-binary, karta-kredytowa, kredyt-got",,,BIZNES,,,,frazy-binary,frazy-binary,1,0,0,0,0,0,0,0,0,0,0,0
,spadek % monologu doradcy,NPS,,Analiza relacji między doradcą a klientem np. czy doradca prowadzi dialog z klientem czy monolog.,7,udział monologu doradcy w trakcie prezentacji oferty kredytowej,,2,zbyt długie monologii doradcy (w początkowej cześci rozmowy),,,ODZ,Jaki procent rozmowy stanowią monologi doradcy - zwłaszcza w początkowej części rozmowy,"talk-time-analysis, dialog, kredyt-got, nps","['talk-time-analysis', 'dialog', 'kredyt-got', 'nps']","talk-time-analysis, dialog, kredyt-got, nps",,ustalenie,KONTROLA,,,,,,0,0,0,0,0,0,0,0,0,0,0,0
,wzrost sprzedaży KG w grupie select,"SR (Sales Revenue), SV (Sales Volumen)",,ofertowanie klientów select,8,% udział ofertowania w rozmowach obsługowych w grupie select,,2,sprawdzenie ofertowania po rozwiązaniu problemu klienta,,,SELECT,Czy podczas rozmowy obsługowej - po rozwiązaniu problemu klienta - występuje przedstwienie oferty,"ofertowanie, frazy-binary, select, service","['ofertowanie', 'frazy-binary', 'select', 'service']","ofertowanie, frazy-binary, select, service",,,BIZNES,,,,frazy-binary,frazy-binary,1,0,0,0,0,0,0,0,0,0,0,0
,rozszeżenie działań nexidi związanych z transkrypcją - inf. o tym który doradca nie zbija obiekcji aby móc z nim pracować.,"SR (Sales Revenue), SV (Sales Volumen)",,sposoby zbijania obekcji/finalizacja sprzedaży,9,weryfikacja w jaki sposob doradca zbija obiekcje - transkrypcja przykąładowych rozmów na tekst w celu weryfikacji (czy nastapiło zbicie obekcji - jeśli tak to w jaki sposób),,3,brak zbijania obiekcji/finalizacji sprzedaży.,,,ODZ,"Identyfikacja, czy występują próby zbijania obiekcji finalizacji sprzedaży przez doradcę, jeśli tak, to zebranie takich sposobów zbicia i podsumowanie ich.","obiekcje, frazy-binary, frazy-ekstrakcja, frazy-clustering, sprzedaż","['obiekcje', 'frazy-binary', 'frazy-ekstrakcja', 'frazy-clustering', 'sprzedaż']","obiekcje, frazy-binary, frazy-ekstrakcja, frazy-clustering, sprzedaż",,wieloetapowe:3,BIZNES,,,,"frazy-binary, frazy-clustering, frazy-ekstrakcja","frazy-binary, frazy-clustering, frazy-ekstrakcja",0,1,0,0,0,0,0,0,0,0,0,0
,,"SR (Sales Revenue), SV (Sales Volumen)",,pls asysta BBC,10,czy byla rozmowa w danym dniu,,1,,,,ODZ,Brak informacji – proszę o uzupełnienie,,[],,,"Brak informacji co jest badane; proszę o doprecyzowanie, czym jest ""pls asysta BBC""",BIZNES,,,,,,0,0,0,0,0,0,0,0,0,0,0,0
,,"SR (Sales Revenue), SV (Sales Volumen)",,"Rozmowy, w których padło pytanie o zobowiązania zewnętrzne/padła oferta konsolidacji.",11,,,1,,,,ODZ,Czy w rozmowie doradca dopytuje o zobowiązania zewnętrzne i proponuje konsolidację? Jakie sformułowania są używane?,"konsolidacja, frazy-binary, frazy-ekstrakcja, frazy-clustering","['konsolidacja', 'frazy-binary', 'frazy-ekstrakcja', 'frazy-clustering']","konsolidacja, frazy-binary, frazy-ekstrakcja, frazy-clustering",,"wieloetapowe:3 - czy na pewno o to chodzi? Czy chodzi o podsumowanie procentowe, czy chcecie frazy, jaka jest potrzeba?",BIZNES,,,,"frazy-binary, frazy-clustering, frazy-ekstrakcja","frazy-binary, frazy-clustering, frazy-ekstrakcja",0,1,0,0,0,0,0,0,0,0,0,0
,,NPS,,"Czy doradca zaproponował asystę w digitalu, czy zostawił klienta zainteresowanego samego w procesie.",12,,,2,,,,ODZ,Czy podczas rozmowy doradca zaproponował asystę klientowi przy wykonaniu samoobsługi w bankowości internetowej/aplikacji,"frazy-binary, asysta-digital, self-service","['frazy-binary', 'asysta-digital', 'self-service']","frazy-binary, asysta-digital, self-service",,,KONTROLA,,,,frazy-binary,frazy-binary,1,0,0,0,0,0,0,0,0,0,0,0
,,NPS,,Powody odmów,13,,,2,,,,ODZ,"Zidentyfikować najczęstsze powody odmów ze strony klientów; wyodrębnić sformułowania opisujące powody, zgrupować je i podać przykłady.","powody-odmow, frazy-binary, frazy-ekstrakcja, frazy-clustering","['powody-odmow', 'frazy-binary', 'frazy-ekstrakcja', 'frazy-clustering']","powody-odmow, frazy-binary, frazy-ekstrakcja, frazy-clustering",,wieloetapowe:3,KONTROLA,,,,"frazy-binary, frazy-clustering, frazy-ekstrakcja","frazy-binary, frazy-clustering, frazy-ekstrakcja",0,1,0,0,0,0,0,0,0,0,0,0
,,"SR (Sales Revenue), SV (Sales Volumen)",,"Analiza Fraz używanych przez doradców, które najczęściej prowadzą do sprzedaży",14,,,1,,,,ODZ,"Analiza rozmów, w których doszło do sprzedaży. Jakie frazy najczęściej prowadzą do sprzedaży","frazy-ekstrakcja, frazy-clustering, analiza-sprzedażowa","['frazy-ekstrakcja', 'frazy-clustering', 'analiza-sprzedażowa']","frazy-ekstrakcja, frazy-clustering, analiza-sprzedażowa",,"wieloetapowe:2 - zakładając, że mamy oznaczone rozmowy, w których doszło do sprzedaży, jeśli nie to konieczne będzie dołożenie kroku frazy-binary",KONTROLA,,,,"frazy-clustering, frazy-ekstrakcja","frazy-clustering, frazy-ekstrakcja",0,0,0,0,0,0,0,0,1,0,0,0
,,NPS,,"Wykrycie rozmów, w których oferujemy kartę za kartę",15,,,2,,,,ODZ,"Wykrycie rozmów, w których doradca proponuje wymianę istniejącej karty kredytowej na nową (karta za kartę).","karta-kredytowa, frazy-binary, ofertowanie, wymiana","['karta-kredytowa', 'frazy-binary', 'ofertowanie', 'wymiana']","karta-kredytowa, frazy-binary, ofertowanie, wymiana",,"Proszę o doprecyzowanie, co oznacza ""karta za kartę""",KONTROLA,,,,frazy-binary,frazy-binary,1,0,0,0,0,0,0,0,0,0,0,0
,,"Quality Score (ocena jakości rozmowy), Missed Information Rate ( wskaźnik brakujących elementów  w rozmowie )",,Identyfikacja wąskich gardeł w rozmowie – kiedy klient traci zainteresowanie? Po informacji kto dzwoni/ w jakim temacie/ jak klient usłyszy koszty?,16,,,2,,,,ODZ,Identyfikacja wąskich gardeł w rozmowie – kiedy klient traci zainteresowanie? Po informacji kto dzwoni/ w jakim temacie/ jak klient usłyszy koszty?,"ofertowanie, frazy-klient-sentyment, frazy-binary,frazy-clustering","['ofertowanie', 'frazy-klient-sentyment', 'frazy-binary', 'frazy-clustering']","ofertowanie, frazy-klient-sentyment, frazy-binary, frazy-clustering",,wieloetapowe:3,KONTROLA,,,,"frazy-binary, frazy-clustering, frazy-klient-sentyment","frazy-binary, frazy-clustering, frazy-klient-sentyment",0,0,0,1,0,0,0,0,0,0,0,0
,,"SR (Sales Revenue), SV (Sales Volumen)",,Service to sales na inboundzie w Select. czy ofertujemy klientów po rozwiązaniu jego sprawy.,17,,,1,,,,SELECT,"Po rozwiązaniu sprawy klienta na linii Select, czy doradca przedstawia ofertę sprzedażową?","ofertowanie, frazy-binaryx2, service","['ofertowanie', 'frazy-binaryx2', 'service']","ofertowanie, frazy-binaryx2, service",,"wieloetapowe:2 - dwukrotne klasyfikacja binary (czy sprawa rozwiązana, czy przedstawienie oferty ) - prośba o doprecyzowanie - potwierdzenia refined-zadania",BIZNES,,,,frazy-binaryx2,frazy-binaryx2,0,0,0,0,0,0,1,0,0,0,0,0
,wzrost x-sell,"SR (Sales Revenue), SV (Sales Volumen)",,x-sell KK do konwersji KO,18,ofertowanie karty kredytowej/konwersje sukces,,1,brak poropozycji karty kredytowej platinum przy konwersji konta,,,SELECT,Czy podczas konwersji konta osobistego doradca proponuje kartę kredytową?,"ofertowanie, frazy-binaryx2, karta-kredytowa, cross-sell","['ofertowanie', 'frazy-binaryx2', 'karta-kredytowa', 'cross-sell']","ofertowanie, frazy-binaryx2, karta-kredytowa, cross-sell",,"co tutaj jest badane - prośba o doprecyzowanie    wieloetapowe:2 - dwukrotne klasyfikacja binary (konwersja konta, czy ofertowanie karty kredytowej)",BIZNES,,,,frazy-binaryx2,frazy-binaryx2,0,0,0,0,0,0,1,0,0,0,0,0
,wzrost identyfikacji za pomocą AM,NPS,,Autoryzacja mobilna,19,"% propozycji ""czy"" z opcją wyboru po stronie konsultanta wychodzące i przychodzące",,2,"Propozycja wyboru AM lub standard weryfikacji, zamiast prio na AM",,,ODZ,Czy doradca proponuje klientowi autoryzację mobilną zamiast standardowej weryfikacji?,"mobilna-autoryzacja, frazy-binary, service, self-service","['mobilna-autoryzacja', 'frazy-binary', 'service', 'self-service']","mobilna-autoryzacja, frazy-binary, service, self-service",,co tutaj jest badane - prośba o doprecyzowanie,KONTROLA,,,,frazy-binary,frazy-binary,1,0,0,0,0,0,0,0,0,0,0,0
,wzrost udziału Remote Sales,NPS,,Możliwość wyboru sposobu finalizacji,20,"% propozycji ""czy"" z opcją wyboru przy finalizacji po stronie konsultanta",,1,"Propozycja wyboru ścieżki finalizacji czy BBC czy E2E, zamiast only BBC a dopiero w przypadku obiekcji E2E lub BR",,,ODZ,Czy doradca przedstawia klientowi możliwość wyboru sposobu finalizacji (BBC/E2E/BR) zamiast narzucać jeden sposób?,"finalizacja, frazy-binary, service","['finalizacja', 'frazy-binary', 'service']","finalizacja, frazy-binary, service",,"prośba o wyjaśnienie skrótów (BBC, E2E, BR) doprecyzowanie - możliwe, że będzie można zrealizować to pod jednym klasyfikatorem na zasadzie lub",PROCES,,,,frazy-binary,frazy-binary,1,0,0,0,0,0,0,0,0,0,0,0
,wzrost efektywności total,"Quality Score (ocena jakości rozmowy), Missed Information Rate ( wskaźnik brakujących elementów  w rozmowie )",,kampanie automatyczne,21,"wszystkie pomysły z ograniczeniem do rodzaju ""kampani/paliwa""",,1,brak możliwości weryfikacji rozmów po rodzaju kampani,,,ODZ,Czy możliwe jest filtrowanie i analizowanie rozmów według rodzaju kampanii (np. automatycznych)? Jakie wnioski chcemy wyciągnąć?,"kampania, segmentacja, frazy-binary","['kampania', 'segmentacja', 'frazy-binary']","kampania, segmentacja, frazy-binary",,"potrzeba doprecyzowania, jakie kampanie mają być analizowane i jaki jest cel",KONTROLA,,,,frazy-binary,frazy-binary,1,0,0,0,0,0,0,0,0,0,0,0
,Wzrost liczby sprzedanych kredytów w rozmowach.,"SR (Sales Revenue), SV (Sales Volumen)",,Kredyt konsumpcyjny,22,Frazes kluczowe związane z ofertą kredytu i finalizacją rozmowy.,,1,Niski odsetek sprzedaży kredytów w trakcie rozmów.,,,ODZ,Zidentyfikować frazy sprzedażowe i finalizujące w rozmowach o kredycie konsumpcyjnym i ocenić ich wpływ na sprzedaż.,"frazy-binary, frazy-ekstrakcja, frazy-clustering, kredyt-got, ofertowanie","['frazy-binary', 'frazy-ekstrakcja', 'frazy-clustering', 'kredyt-got', 'ofertowanie']","frazy-binary, frazy-ekstrakcja, frazy-clustering, kredyt-got, ofertowanie",,wieloetapowe:3 - proszę o doprecyzowanie wpływu na sprzedaż,BIZNES,,,,"frazy-binary, frazy-clustering, frazy-ekstrakcja","frazy-binary, frazy-clustering, frazy-ekstrakcja",0,1,0,0,0,0,0,0,0,0,0,0
,Zwiększenie średniej wartości kredytów.,"SR (Sales Revenue), SV (Sales Volumen)",,Kredyt konsumpcyjny,23,"Frazes dotyczące warunków kredytu, takich jak kwota i rata.",,1,Niska średnia wartość udzielanych kredytów.,,,ODZ,"Analiza rozmów pod kątem omawiania kwoty i raty kredytu; czy doradca wykorzystuje te elementy, aby zachęcić do wyższej kwoty?","frazy-binary, frazy-ekstrakcja, frazy-clustering, kredyt-got, kwota, rata","['frazy-binary', 'frazy-ekstrakcja', 'frazy-clustering', 'kredyt-got', 'kwota', 'rata']","frazy-binary, frazy-ekstrakcja, frazy-clustering, kredyt-got, kwota, rata",,"wieloetapowe:3 - proszę o doprecyzowaie, czy prawidłowo określiliśmy zadanie w polu refined_zadanie",BIZNES,,,,"frazy-binary, frazy-clustering, frazy-ekstrakcja","frazy-binary, frazy-clustering, frazy-ekstrakcja",0,1,0,0,0,0,0,0,0,0,0,0
,Wzrost liczby produktów cross-sell sprzedanych w rozmowie.,"SR (Sales Revenue), SV (Sales Volumen)",,Cross-sell (kredyt + ubezpieczenie),24,Frazes związane z oferowaniem produktów dodatkowych i ich korzyściami.,,2,Niski wskaźnik oferowania produktów dodatkowych w rozmowach.,,,ODZ,Czy doradca podczas rozmowy o kredycie proponuje dodatkowe ubezpieczenie oraz jakie korzyści przedstawia?,"cross-sell, frazy-binary, frazy-ekstrakcja, frazy-clustering, kredyt-got, ubezpieczenia","['cross-sell', 'frazy-binary', 'frazy-ekstrakcja', 'frazy-clustering', 'kredyt-got', 'ubezpieczenia']","cross-sell, frazy-binary, frazy-ekstrakcja, frazy-clustering, kredyt-got, ubezpieczenia",,"wieloetapowe:3 - proszę o doprecyzowaie, czy prawidłowo określiliśmy zadanie w polu refined_zadanie",BIZNES,,,,"frazy-binary, frazy-clustering, frazy-ekstrakcja","frazy-binary, frazy-clustering, frazy-ekstrakcja",0,1,0,0,0,0,0,0,0,0,0,0
,Zmniejszenie liczby klientów kierowanych do oddziałów.,"SR (Sales Revenue), SV (Sales Volumen)",,Kredyt konsumpcyjny,25,Częstość przenoszenia klientów do oddziałów i powody tego działania.,,2,Zbyt dużo klientów kierowanych do oddziałów zamiast finalizacji telefonicznej.,,,ODZ,"Czy klient został przekierowany do oddziału zamiast sfinalizować kredyt telefonicznie, i jakie były powody?","service, frazy-binary, frazy-ekstrakcja, frazy-clustering, kredyt-got","['service', 'frazy-binary', 'frazy-ekstrakcja', 'frazy-clustering', 'kredyt-got']","service, frazy-binary, frazy-ekstrakcja, frazy-clustering, kredyt-got",,wieloetapowe:3,BIZNES,,,,"frazy-binary, frazy-clustering, frazy-ekstrakcja","frazy-binary, frazy-clustering, frazy-ekstrakcja",0,1,0,0,0,0,0,0,0,0,0,0
,Poprawa skuteczności rozmów w mniej efektywnych segmentach klientów.,NPS,,Segmentacja klientów,26,Analiza skuteczności rozmów w zależności od segmentu klienta.,,2,Nierównomierna skuteczność rozmów między różnymi segmentami klientów.,,,ODZ,Analiza skuteczności rozmów w zależności od segmentu klienta; jakie elementy rozmowy wpływają na sukces w poszczególnych segmentach?,"frazy-binary, frazy-ekstrakcja,frazy-clustering, llm-opis-segment, nps","['frazy-binary', 'frazy-ekstrakcja', 'frazy-clustering', 'llm-opis-segment', 'nps']","frazy-binary, frazy-ekstrakcja, frazy-clustering, llm-opis-segment, nps",,wieloetapowe:4 - jeśli tylko sprzedazowe analizujemy to 3 (ustalenie),KONTROLA,,,,"frazy-binary, frazy-clustering, frazy-ekstrakcja","frazy-binary, frazy-clustering, frazy-ekstrakcja",0,1,0,0,0,0,0,0,0,0,0,0
,Zwiększenie liczby obiekcji skutecznie rozwiązanych przez doradców.,NPS,,Zarządzanie obiekcjami,27,Identyfikacja obiekcji klientów i odpowiedzi doradców na te obiekcje.,,2,Niska skuteczność doradców w odpowiadaniu na obiekcje klientów.,,,ODZ,Identyfikacja obiekcji klientów i odpowiedzi doradców; ocena skuteczności zarządzania obiekcjami,"obiekcje, frazy-binary, frazy-ekstrakcja, frazy-clustering, nps, llm-opis-ocena","['obiekcje', 'frazy-binary', 'frazy-ekstrakcja', 'frazy-clustering', 'nps', 'llm-opis-ocena']","obiekcje, frazy-binary, frazy-ekstrakcja, frazy-clustering, nps, llm-opis-ocena",,wieloetapowe:4 (ustalenie),KONTROLA,,,,"frazy-binary, frazy-clustering, frazy-ekstrakcja","frazy-binary, frazy-clustering, frazy-ekstrakcja",0,1,0,0,0,0,0,0,0,0,0,0
,Poprawa satysfakcji klienta i wyższa finalizacja rozmów.,NPS,,Komunikacja doradcy (parafrazowanie),28,Częstość używania fraz potwierdzających i parafrazowania przez doradców.,,2,Brak aktywnego słuchania i potwierdzania potrzeb klientów.,,,ODZ,"Czy w rozmowie doradca aktywnie słucha i potwierdza potrzeby klienta - czy parafrazuje to, co powiedział klient","frazy-binary, pair-classfication-client-agent, service,nps","['frazy-binary', 'pair-classfication-client-agent', 'service', 'nps']","frazy-binary, pair-classfication-client-agent, service, nps",,wieloetapowe:2 (lub jeden etap tylko pair classification - do ustalenia),KONTROLA,,,,frazy-binary,frazy-binary,1,0,0,0,0,0,0,0,0,0,0,0
,"Lepsze dopasowanie ofert kredytowych do potrzeb klientów, zwiększenie sprzedaży.","SR (Sales Revenue), SV (Sales Volumen)",,Kredyt konsumpcyjny,29,Analiza dopasowania oferty kredytowej na podstawie fraz związanych z potrzebami klientów.,,2,Brak odpowiedniego dostosowania oferty kredytowej do potrzeb klientów.,,,ODZ,Czy doradcy badają potrzeby klienta i dostosowują ofertę kredytu gotówkowego; analiza fraz dotyczących potrzeb i dopasowania oferty.,"nps, frazy-binaryx2, frazy-ekstrakcja, frazy-clustering, kredyt-got","['nps', 'frazy-binaryx2', 'frazy-ekstrakcja', 'frazy-clustering', 'kredyt-got']","nps, frazy-binaryx2, frazy-ekstrakcja, frazy-clustering, kredyt-got",,wieloetapowe:3 (ustalenie),BIZNES,,,,"frazy-binaryx2, frazy-clustering, frazy-ekstrakcja","frazy-binaryx2, frazy-clustering, frazy-ekstrakcja",0,0,0,0,0,0,0,1,0,0,0,0
,Wzrost zainteresowania kartami kredytowymi i ich sprzedaż.,"SR (Sales Revenue), SV (Sales Volumen)",,Karta kredytowa,30,Wykrywanie fraz promujących karty kredytowe w rozmowach i ich korelacja z finalizacją sprzedaży.,,1,Niska liczba klientów zainteresowanych kartami kredytowymi.,,,ODZ,"Wyszukiwanie rozmów, w których doradcy promują karty kredytowe i analizowanie wpływu takich fraz na finalizację sprzedaży.","promocje, frazy-binary, frazy-ekstrakcja, frazy-clustering, karta-kredytowa","['promocje', 'frazy-binary', 'frazy-ekstrakcja', 'frazy-clustering', 'karta-kredytowa']","promocje, frazy-binary, frazy-ekstrakcja, frazy-clustering, karta-kredytowa",,wieloetapowe:3 - do doprecyzowania o co chodzi o korealcja finalizacji sprzedaży,BIZNES,,,,"frazy-binary, frazy-clustering, frazy-ekstrakcja","frazy-binary, frazy-clustering, frazy-ekstrakcja",0,1,0,0,0,0,0,0,0,0,0,0
,"Zwiększenie liczby rozmów, w których przedstawiana jest oferta kredytowa.","SR (Sales Revenue), SV (Sales Volumen)",,Kredyt konsumpcyjny,31,Frazes związane z przedstawianiem oferty kredytu w trakcie rozmowy.,,2,"Doradcy nie oferują kredytów przy każdej rozmowie, gdy jest to możliwe.",,,ODZ,"Czy doradca miał szansę zaproponować kredyt, ale tego nie zrobił? Gdy przedstawił ofertę, to jakich fraz użył","ofertowanie, frazy-binary, frazy-ekstrakcja, frazy-clustering, kredyt","['ofertowanie', 'frazy-binary', 'frazy-ekstrakcja', 'frazy-clustering', 'kredyt']","ofertowanie, frazy-binary, frazy-ekstrakcja, frazy-clustering, kredyt",,"wieloetapowe:3 (lub 4, jeśli dorzucimy llm-podsumowanie - w zależności od potrzeb) czy to ma być przekrojowe - jakie frazy występują, gdy występuje ofertowanie kredytu? Prośba o doprecyzowanie",BIZNES,,,,"frazy-binary, frazy-clustering, frazy-ekstrakcja","frazy-binary, frazy-clustering, frazy-ekstrakcja",0,1,0,0,0,0,0,0,0,0,0,0
,Większa liczba klientów korzystających z kart kredytowych dzięki lepszemu przedstawieniu ich korzyści.,"SR (Sales Revenue), SV (Sales Volumen)",,Karta kredytowa,32,Frazes dotyczące promocji kart kredytowych i unikalnych korzyści.,,2,"Brak odpowiedniego promowania korzyści karty kredytowej, takich jak cashback czy programy lojalnościowe.",,,ODZ,"Czy doradca przedstawia zalety karty kredytowej - cashback, programy lojalnościowe, i inne korzyści","ofertowanie,frazy-binary, karta kredytowa","['ofertowanie', 'frazy-binary', 'karta-kredytowa']","ofertowanie, frazy-binary, karta-kredytowa",,czy chcem zbierać informacje w jaki sposób? Czy tylko czy? - prośba o doprecyzowanie,BIZNES,,,,frazy-binary,frazy-binary,1,0,0,0,0,0,0,0,0,0,0,0
,Większy odsetek klientów aktywujących limity w koncie.,"SR (Sales Revenue), SV (Sales Volumen)",,Limit w koncie,33,"Wykrywanie rozmów, w których oferta limitu w koncie nie została przedstawiona.",,3,Niski odsetek klientów korzystających z limitów w koncie.,,,ODZ,"Wykrywanie rozmów, w których oferta limitu w koncie nie została przedstawiona.","limit, frazy-binary, ofertowanie","['limit', 'frazy-binary', 'ofertowanie']","limit, frazy-binary, ofertowanie",,czy chcem zbierać informacje w jaki sposób? Czy tylko czy? - prośba o doprecyzowanie,BIZNES,,,,frazy-binary,frazy-binary,1,0,0,0,0,0,0,0,0,0,0,0
,Zwiększenie sprzedaży limitów w koncie poprzez lepsze przedstawienie ich zalet.,"SR (Sales Revenue), SV (Sales Volumen)",,Limit w koncie,34,Analiza fraz dotyczących korzyści limitu w koncie i ich wpływu na decyzję klienta.,,3,"Niewystarczające omawianie korzyści limitów w koncie (np. elastyczność, szybki dostęp do środków).",,,ODZ,"Czy pojawiło się ofertowanie limitu w koncie?  Jeśli tak, to jak doradca ofertował klienta i jak poszczególne sformułowania wpływały na decyzje","ofertowanie, frazy-binary, frazy-ekstrakcja, frazy-clustering, frazy-klient-sentyment, limit","['ofertowanie', 'frazy-binary', 'frazy-ekstrakcja', 'frazy-clustering', 'frazy-klient-sentyment', 'limit']","ofertowanie, frazy-binary, frazy-ekstrakcja, frazy-clustering, frazy-klient-sentyment, limit",,wieloetapowe: 4 - częściowy dubel wiersz 37 - prośba o doprecyzowanie,BIZNES,,,,"frazy-binary, frazy-clustering, frazy-ekstrakcja, frazy-klient-sentyment","frazy-binary, frazy-clustering, frazy-ekstrakcja, frazy-klient-sentyment",0,0,1,0,0,0,0,0,0,0,0,0
,Poprawa skuteczności rozmów poprzez lepsze zarządzanie obiekcjami.,"SR (Sales Revenue), SV (Sales Volumen)",,Kredyt konsumpcyjny,35,Identyfikacja najczęściej występujących obiekcji klientów przy rozmowach o kredytach.,,2,"Nieodpowiednie zarządzanie obiekcjami klientów, szczególnie w rozmowach o kredytach.",,,ODZ,Czy klient zgłosił obiekcje do finalizacji? Jakie było to obiekcje?,"obiekcje, frazy-binary, frazy-ekstrakcja, frazy-clustering,kredyt-got","['obiekcje', 'frazy-binary', 'frazy-ekstrakcja', 'frazy-clustering', 'kredyt-got']","obiekcje, frazy-binary, frazy-ekstrakcja, frazy-clustering, kredyt-got",,wieloetapowe:3 (opcjonalnie 4 - gdy chcemy llm-podsumowanie),BIZNES,,,,"frazy-binary, frazy-clustering, frazy-ekstrakcja","frazy-binary, frazy-clustering, frazy-ekstrakcja",0,1,0,0,0,0,0,0,0,0,0,0
